{"schema_version":"0.1","message_id":"msg_01J000000000000000000001","agent_id":"agt_01J000000000000000000001","property_id":"prp_01J000000000000000000001","event_sequence":42,"session_id":"ses_01J000000000000000000001","observed_at":"2026-07-14T12:00:00+00:00","event_type":"target_state_changed","target_id":"tgt_camera_front_door_001","target_label":"Front door camera","from_state":"up","to_state":"down","evidence":["tcp_connect_timeout","selected_critical_target"],"gateway_state":"up","internet_state":"up"}
